case_id,external_case_family,primary_source,observed_application_pressure,claim_governance_gap,example_submitted_claim,licensed_response,tool_mapping,boundary
APP-01,model reporting,https://huggingface.co/papers/1810.03993,"Model cards emphasize intended use, limitations, and subgroup performance reporting.","A model card can document limits, but a reviewer still needs to decide whether a specific metric sentence is licensed or overextended.","The model is reliable for all intended users.","Rewrite to a subgroup/context-bounded claim tied to the reported evaluation slice.",reviewer_claim_intake: rewrite forbidden broad model claim to licensed local claim,not a replacement for full model cards
APP-02,dataset documentation,https://www.microsoft.com/en-us/research/publication/datasheets-for-datasets/,"Datasheets document dataset motivation, composition, collection, recommended uses, and related context.","Dataset documentation does not by itself decide whether a downstream empirical claim crosses source or use boundaries.","This dataset validates deployment in the target domain.","Reject admission until evidence unit, G/Q/U, action, preorder, forbidden claim, and visual anchor are declared.",template_admission: require evidence unit plus G/Q/U and forbidden claim before domain admission,not a raw-data redistribution or dataset-quality guarantee
APP-03,real-world distribution shift benchmark,https://proceedings.mlr.press/v139/koh21a.html,"WILDS collects datasets with natural distribution shifts across settings such as hospitals, camera traps, location, and time.","A benchmark score under shift can be misread as a broader deployment or cross-context robustness claim.","The method is robust to real-world shifts.","Rewrite to the specific shift family, metric layer, and decision-use boundary evidenced by the benchmark cell.",claim_audit_report: expose G boundary and decision-use limits before emitting a claim,not a new distribution-shift benchmark
APP-04,behavioral testing,https://arxiv.org/abs/2005.04118,"CheckList turns model evaluation into targeted capability and behavior tests rather than only aggregate accuracy.","Behavioral failures still need claim-level wording discipline: a failed capability test licenses a bounded behavior claim, not universal model invalidity.","The model does not understand negation.","Weaken to a diagnostic claim about the tested capability and generated test family.",reviewer_claim_intake: rewrite tempting global claim to bounded diagnostic claim,not an NLP test generator
APP-05,robustness evaluation toolkit,https://arxiv.org/abs/2101.04840,"Robustness Gym unifies subpopulations, transformations, evaluation sets, and adversarial attacks for NLP evaluation.","A toolkit can produce many slices and tests; the reporting layer must still prevent slice evidence from becoming broad robustness language.","The model is robust after passing the evaluated slices.","Admit only as a slice/test-family claim or support-only robustness witness unless the template contract licenses broader language.",claim_template_admission: require template role and support-only ceiling before adding new evaluation rows,not a universal robustness evaluator
APP-06,selective prediction,https://papers.neurips.cc/paper/7073-selective-classification-for-deep-neural-networks,"Selective classification trades coverage for risk and supports abstention or reject-option reasoning.","A low-risk selected subset claim should not automatically become a full-coverage performance or deployment claim.","The classifier has low deployment error.","Rewrite to risk-at-coverage over the selected subset, or suppress the full-coverage deployment claim.",reviewer_claim_intake: suppress or rewrite unsupported full-coverage claim under declared use context,not a selective-classification algorithm
